{
  "formatId": "infrastructure-cyber-lab.troubleshooting-session",
  "schemaVersion": "0.1.0",
  "scenarioId": "foundation_acceptance",
  "scenarioHash": "aaaaaaaaaaaaaaaaaaaaaaaaaaaaaaaaaaaaaaaaaaaaaaaaaaaaaaaaaaaaaaaa",
  "stateRevision": 1,
  "notebookIdentity": "bbbbbbbbbbbbbbbbbbbbbbbbbbbbbbbbbbbbbbbbbbbbbbbbbbbbbbbbbbbbbbbb",
  "sessionIdentity": "cccccccccccccccccccccccccccccccccccccccccccccccccccccccccccccccc",
  "progress": {
    "formatId": "infrastructure-cyber-lab.save",
    "scenarioHash": "aaaaaaaaaaaaaaaaaaaaaaaaaaaaaaaaaaaaaaaaaaaaaaaaaaaaaaaaaaaaaaaa",
    "stateRevision": 1
  },
  "notebook": {
    "formatId": "infrastructure-cyber-lab.troubleshooting-notebook",
    "scenarioId": "foundation_acceptance",
    "scenarioHash": "aaaaaaaaaaaaaaaaaaaaaaaaaaaaaaaaaaaaaaaaaaaaaaaaaaaaaaaaaaaaaaaa",
    "notebookIdentity": "bbbbbbbbbbbbbbbbbbbbbbbbbbbbbbbbbbbbbbbbbbbbbbbbbbbbbbbbbbbbbbbb",
    "entries": []
  }
}
